{
  "schema_version": "0.2.0",
  "session_id": "c3e1a0c4-9d7a-4f1e-8c90-9e5d9e21a7ad",
  "title": {"name":"Star Atlas", "build":"1.24.3", "map":"SOG_Corvus"},
  "capture": {"host_os":"Windows 11", "gpu":"RTX 4090", "driver":"552.44",
              "encoder":"AV1_SVT", "clock":"monotonic_us"},
  "display": {"resolution":"1280x720","fps":60,"hdr":false},
  "timing":  {"t0_us": 1722900000000, "timezone":"UTC"},
  "privacy": {"voice_raw": false, "chat_raw": false, "labels_only": true, "consent":"on-file"},
  "geo": {"h3":"8a2a1072b59ffff"},
  "rights": {"publisher_license":"ref#...","player_consent_id":"ref#..."}
} 